{
  "policy_id": "sham",
  "policy_type": "sham",
  "model_id": "synthetic-7b",
  "model_revision": "1.0",
  "feature_schema_digest": "3866f7d6cf57d26334ad2dfaeab993a33a7a625931ab213a3f24056f24c73806",
  "feature_transform_digest": "exec_features_v2",
  "weights": [
    [
      0.0,
      0.0,
      0.0,
      0.0,
      0.0,
      0.0,
      0.0,
      0.0,
      0.0,
      0.0,
      0.0,
      0.0,
      0.0,
      0.0,
      0.0,
      0.0,
      0.0
    ],
    [
      0.0,
      0.0,
      0.0,
      0.0,
      0.0,
      0.0,
      0.0,
      0.0,
      0.0,
      0.0,
      0.0,
      0.0,
      0.0,
      0.0,
      0.0,
      0.0,
      0.0
    ],
    [
      0.0,
      0.0,
      0.0,
      0.0,
      0.0,
      0.0,
      0.0,
      0.0,
      0.0,
      0.0,
      0.0,
      0.0,
      0.0,
      0.0,
      0.0,
      0.0,
      0.0
    ],
    [
      0.0,
      0.0,
      0.0,
      0.0,
      0.0,
      0.0,
      0.0,
      0.0,
      0.0,
      0.0,
      0.0,
      0.0,
      0.0,
      0.0,
      0.0,
      0.0,
      0.0
    ]
  ],
  "bias": [
    0.0,
    0.0,
    0.0,
    0.0
  ],
  "action_ordering": [
    "ANSWER_DIRECT",
    "RETRIEVE_MEMORY",
    "CALL_TOOL",
    "START_WORKFLOW"
  ],
  "normalization_state": {},
  "training_seed": 42,
  "training_split_digest": "experience",
  "learner_config_digest": "logistic_regression",
  "policy_sha256": "a90b62b241496fc1c71f328b50231688eb99272f9c9df79d4a25b2dd4bdb9572"
}